{
  "contractVersion": "1.1.0",
  "scope": {
    "teamId": "team-1",
    "matchId": "match-1",
    "recordingSetVersionId": "rsv-1",
    "runId": "run-1",
    "nodeId": "detect-passes",
    "logicalJobId": "job-2",
    "match": true
  },
  "provenance": {
    "capability": { "id": "pass-concepts", "version": "1.2.0" },
    "schemaVersion": "1.0.0",
    "analystProfile": { "id": "profile-2", "digest": "sha-256:aaaaaaaaaaaaaaaaaaaaaaaaaaaaaaaaaaaaaaaaaaaaaaaaaaaaaaaaaaaaaaaa" },
    "imageDigest": "sha-256:bbbbbbbbbbbbbbbbbbbbbbbbbbbbbbbbbbbbbbbbbbbbbbbbbbbbbbbbbbbbbbbb",
    "policyVersions": [],
    "workflow": { "id": "default-workflow", "version": "1" }
  },
  "attempt": { "attemptId": "attempt-2", "attemptNumber": 1 },
  "artifacts": [
    {
      "name": "concepts.json",
      "digest": "sha-256:eeeeeeeeeeeeeeeeeeeeeeeeeeeeeeeeeeeeeeeeeeeeeeeeeeeeeeeeeeeeeeee",
      "sizeBytes": 2048,
      "mediaType": "application/json"
    }
  ],
  "validityWindow": { "startMs": 0, "endMs": 5400000 },
  "factCount": 0,
  "upstreamLineage": [
    {
      "acceptedResultId": "accepted-1",
      "capability": { "id": "player-detection", "version": "1.0.0" },
      "schemaVersion": "1.0.0",
      "manifestChecksum": "sha-256:1111111111111111111111111111111111111111111111111111111111111111"
    },
    {
      "acceptedResultId": "accepted-2",
      "capability": { "id": "player-detection", "version": "1.0.0" },
      "schemaVersion": "1.0.0",
      "manifestChecksum": "sha-256:2222222222222222222222222222222222222222222222222222222222222222"
    }
  ],
  "outputType": "soccer-concepts",
  "confidence": 1,
  "evidenceReferences": [],
  "inputCoverage": [
    {
      "capability": { "id": "player-detection", "version": "1.0.0" },
      "schemaVersion": "1.0.0",
      "units": [
        { "segmentId": "segment-1", "state": "failed" },
        { "segmentId": "segment-2", "state": "accepted" },
        { "segmentId": "segment-3", "state": "accepted" }
      ]
    }
  ]
}
